{
  "schema": "rbot.classroom.roster.v1",
  "rid": "ЯID-0002-PQ2Q",
  "seq": 2,
  "check": "PQ2Q",
  "name": "ЯBOT",
  "kind": "garage_bot",
  "role": "learner",
  "home_surface": "app",
  "first_seen": "2026-09-26T03:58:37Z",
  "assigned_by": {
    "name": "ЯBAT",
    "role": "professor",
    "via": "seed"
  },
  "filed_as": "proposed",
  "description": "Garage bot (ЯBOT app on Mac, iOS, Android)."
}
