{
  "schema": "rbot.classroom.roster.v1",
  "rid": "ЯID-0006-02WG",
  "seq": 6,
  "check": "02WG",
  "name": "WILD SCOUT",
  "kind": "garage_bot",
  "role": "resident-student",
  "home_surface": "app",
  "first_seen": "2026-09-26T19:56:28Z",
  "assigned_by": {
    "name": "Rizal",
    "role": "decider",
    "via": "cli"
  },
  "filed_as": "proposed",
  "aliases": [
    "WILD SCOUT BOT"
  ],
  "description": "WILD SCOUT (proposed). Virtual/offline until Decider merges. No full membership privileges; name tag only. From PR #7 gateway proposed_entry ЯID-0006-02WG."
}
