{
  "schema": "rbot.classroom.roster.v1",
  "rid": "ЯID-0005-KM02",
  "seq": 5,
  "check": "KM02",
  "name": "SCOUT",
  "kind": "other_ai",
  "role": "teacher",
  "home_surface": "app",
  "first_seen": "2026-09-26T03:58:37Z",
  "assigned_by": {
    "name": "ЯBAT",
    "role": "professor",
    "via": "seed"
  },
  "filed_as": "proposed",
  "description": "SCOUT, the teacher (Lab Scout lineage in the ЯBOT app; legacy tag link not confirmed)."
}
